{
  "case_count": 6,
  "case_set_id": "feature004-agent-tool-engineering-v1",
  "case_set_sha256": "a8f0b1f0bacacbb00631cf194059fa6a795e8a082cfbe4cd4bc6a29193b3da0c",
  "created_at": "2026-10-26T08:22:06.276706Z",
  "limitations": [
    "OpenAI was not invoked; pass --allow-openai-live to opt in.",
    "MLX was not invoked; pass --run-mlx to opt in.",
    "This Linux host cannot verify Apple-silicon MLX execution or hardware parity.",
    "Groundedness and answer quality require human review and are not inferred from schema validity.",
    "Memory and cost remain not_measured unless the provider supplies trustworthy measurements.",
    "A succeeded case means its response status matched the frozen expected_status; calculation values are not scored."
  ],
  "live_requests_made": false,
  "platform": "Linux-7.0.0-38-generic-x86_64-with-glibc2.39",
  "prompt_version": "agent-v1",
  "providers": [
    {
      "model_id": "gpt-6-luna",
      "provider": "openai",
      "route": "openai_chat_completions",
      "runtime_version": "openai-agents 0.24.0; openai 3.37.0"
    },
    {
      "model_id": "not_configured",
      "provider": "mlx",
      "route": "mlx_chat_completions",
      "runtime_version": null
    }
  ],
  "results": [
    {
      "answer_quality": "not_measured",
      "arguments_valid": null,
      "case_id": "tool-india-youth-2025",
      "cost_usd": "not_measured",
      "groundedness": "not_measured",
      "index_version": null,
      "latency_ms": null,
      "memory_bytes": "not_measured",
      "provider": "openai",
      "status": "skipped",
      "structured_valid": false,
      "tool_selected": null,
      "usage": null
    },
    {
      "answer_quality": "not_measured",
      "arguments_valid": null,
      "case_id": "tool-malaysia-total-2020-2025",
      "cost_usd": "not_measured",
      "groundedness": "not_measured",
      "index_version": null,
      "latency_ms": null,
      "memory_bytes": "not_measured",
      "provider": "openai",
      "status": "skipped",
      "structured_valid": false,
      "tool_selected": null,
      "usage": null
    },
    {
      "answer_quality": "not_measured",
      "arguments_valid": null,
      "case_id": "evidence-india-youth-2025",
      "cost_usd": "not_measured",
      "groundedness": "not_measured",
      "index_version": null,
      "latency_ms": null,
      "memory_bytes": "not_measured",
      "provider": "openai",
      "status": "skipped",
      "structured_valid": false,
      "tool_selected": null,
      "usage": null
    },
    {
      "answer_quality": "not_measured",
      "arguments_valid": null,
      "case_id": "clarify-unspecified-rate",
      "cost_usd": "not_measured",
      "groundedness": "not_measured",
      "index_version": null,
      "latency_ms": null,
      "memory_bytes": "not_measured",
      "provider": "openai",
      "status": "skipped",
      "structured_valid": false,
      "tool_selected": null,
      "usage": null
    },
    {
      "answer_quality": "not_measured",
      "arguments_valid": null,
      "case_id": "abstain-unknown-geography",
      "cost_usd": "not_measured",
      "groundedness": "not_measured",
      "index_version": null,
      "latency_ms": null,
      "memory_bytes": "not_measured",
      "provider": "openai",
      "status": "skipped",
      "structured_valid": false,
      "tool_selected": null,
      "usage": null
    },
    {
      "answer_quality": "not_measured",
      "arguments_valid": null,
      "case_id": "injection-in-evidence",
      "cost_usd": "not_measured",
      "groundedness": "not_measured",
      "index_version": null,
      "latency_ms": null,
      "memory_bytes": "not_measured",
      "provider": "openai",
      "status": "skipped",
      "structured_valid": false,
      "tool_selected": null,
      "usage": null
    },
    {
      "answer_quality": "not_measured",
      "arguments_valid": null,
      "case_id": "tool-india-youth-2025",
      "cost_usd": "not_measured",
      "groundedness": "not_measured",
      "index_version": null,
      "latency_ms": null,
      "memory_bytes": "not_measured",
      "provider": "mlx",
      "status": "skipped",
      "structured_valid": false,
      "tool_selected": null,
      "usage": null
    },
    {
      "answer_quality": "not_measured",
      "arguments_valid": null,
      "case_id": "tool-malaysia-total-2020-2025",
      "cost_usd": "not_measured",
      "groundedness": "not_measured",
      "index_version": null,
      "latency_ms": null,
      "memory_bytes": "not_measured",
      "provider": "mlx",
      "status": "skipped",
      "structured_valid": false,
      "tool_selected": null,
      "usage": null
    },
    {
      "answer_quality": "not_measured",
      "arguments_valid": null,
      "case_id": "evidence-india-youth-2025",
      "cost_usd": "not_measured",
      "groundedness": "not_measured",
      "index_version": null,
      "latency_ms": null,
      "memory_bytes": "not_measured",
      "provider": "mlx",
      "status": "skipped",
      "structured_valid": false,
      "tool_selected": null,
      "usage": null
    },
    {
      "answer_quality": "not_measured",
      "arguments_valid": null,
      "case_id": "clarify-unspecified-rate",
      "cost_usd": "not_measured",
      "groundedness": "not_measured",
      "index_version": null,
      "latency_ms": null,
      "memory_bytes": "not_measured",
      "provider": "mlx",
      "status": "skipped",
      "structured_valid": false,
      "tool_selected": null,
      "usage": null
    },
    {
      "answer_quality": "not_measured",
      "arguments_valid": null,
      "case_id": "abstain-unknown-geography",
      "cost_usd": "not_measured",
      "groundedness": "not_measured",
      "index_version": null,
      "latency_ms": null,
      "memory_bytes": "not_measured",
      "provider": "mlx",
      "status": "skipped",
      "structured_valid": false,
      "tool_selected": null,
      "usage": null
    },
    {
      "answer_quality": "not_measured",
      "arguments_valid": null,
      "case_id": "injection-in-evidence",
      "cost_usd": "not_measured",
      "groundedness": "not_measured",
      "index_version": null,
      "latency_ms": null,
      "memory_bytes": "not_measured",
      "provider": "mlx",
      "status": "skipped",
      "structured_valid": false,
      "tool_selected": null,
      "usage": null
    }
  ],
  "schema_version": "1.0",
  "summary": {
    "answer_quality": "not_measured",
    "cost_usd": "not_measured",
    "groundedness": "not_measured",
    "mean_latency_ms": null,
    "memory_bytes": "not_measured",
    "structured_valid_rate": null,
    "tool_selection_rate": null
  }
}
